<?xml version="1.0"?>
<!DOCTYPE listado SYSTEM "listado.dtd">

<listado>
  <futuro precio="12.59">
    <producto>Salchichas</producto>
    <mercado>Europa</mercado>
    <ciudad_procedencia>
      <Frankfurt/>
    </ciudad_procedencia>
  </futuro>
  <divisa precio="1698">
    <nombre_divisa>Euro</nombre_divisa>
    <tipo_de_cambio>2.1:1 euros</tipo_de_cambio>
    <tipo_de_cambio>1:0.87 dólares</tipo_de_cambio>
    <ciudad_procedencia>
      <Madrid/>
    </ciudad_procedencia>
  </divisa>
  <bono precio="19240" estable="no">
    <pais_de_procedencia>
      Marruecos
    </pais_de_procedencia>
    <valor_deseado>1250</valor_deseado>
    <valor_minimo>3981</valor_minimo>
    <valor_maximo>18090</valor_maximo>
    <ciudad_procedencia>
      <Tokio/>
    </ciudad_procedencia>
  </bono>
  <letra precio="96310">
    <tipo_de_interes>7.91%</tipo_de_interes>
    <pais_emisor>
      <España/>
    </pais_emisor>
    <ciudad_procedencia>
      <Madrid/>
    </ciudad_procedencia>
  </letra>
</listado>